[{"index":"angle","name":"Angles","book":"Monster Manual","desc":"An angel is a celestial agent sent forth into the planes to further its god's agenda for weal or woe. Its sublime beauty and presence can drive awestruck onlookers to their knees. Yet angels are destroyers too, and their appearance portends doom as often as it signals hope.<br/><br/><b>Shards of the Divine</b>. Angels are formed from the astral essence of benevolent gods and are thus divine beings of great power and foresight.<br/>Angels act out the will of their gods with tireless devotion. Even chaotic good deities command lawful good angels, knowing that the angels' dedication to order best allows them to fulfill divine commands. An angel follows a single driving purpose, as decreed by its deity. However, an angel is incapable of following commands that stray from the path of law and good.<br/>An angel slays evil creatures without remorse. As the embodiment of law and good, an angel is almost never mistaken in its judgments. This quality can create a sense of superiority in an angel, a sense that comes to the fore when an angel's task conflicts with the goals of another creature. The angel never acquiesces or gives way. When an angel is sent to aid mortals, it is sent not to serve but to command. The gods of good therefore send their angels among mortals only in response to the most dire circumstances.<br/><br/><b>Fallen Angels</b>. An angel's moral compass grants it a sense of infallibility that can sometimes spell its undoing. Angels are usually too wise to fall for a simple deception, but sometimes pride can lead one to commit an evil act. Whether intentional or accidental, such an act is a permanent stain that marks the angel as an outcast.<br/>Fallen angels retain their power but lose their connection to the deities from which they were made. Most fallen angels take their banishment personally, rebelling against the powers they served by seeking rulership over a section of the Abyss or a place among other fallen in the hierarchy of the Nine Hells. Zariel, the ruler of the first layer of the Nine Hells, is such a creature. Rather than rebel, some fallen angels resign themselves to an isolated existence on the Material Plane, living in disguise as simple hermits. If they are redeemed, they can become powerful allies dedicated to justice and compassionate service.<br/><br/><b>Immortal Nature</b>. An angel doesn't require food, drink, or sleep.","monsters":["deva","planetar","solar"],"page":15},{"index":"animated-object","name":"Animated Objects","book":"Monster Manual","desc":"Animated objects are crafted with potent magic to follow the commands of their creators. When not commanded, they follow the last order they received to the best of their ability, and can act independently to fulfill simple instructions. Some animated objects (including many of those created in the Feywild) might converse fluently or adopt a persona, but most are simple automatons.<br/><br/><b>Constructed Nature</b>. An animated object doesn't require air, food, drink, or sleep.<br/>The magic that animates an object is dispelled when the construct drops to 0 hit points. An animated object reduced to 0 hit points becomes inanimate and is too damaged to be of much use or value to anyone.","monsters":["animated-armor","flying-sword","rug-of-smothering"],"page":19},{"index":"beholder","name":"Beholders","book":"Monster Manual","desc":"One glance at a beholder is enough to assess its foul and otherworldly nature. Aggressive, hateful, and greedy, these aberrations dismiss all other creatures as lesser beings, toying with them or destroying them as they choose. <br/>A beholder's spheroid body levitates at all times, and its great bulging eye sits above a wide, toothy maw, while the smaller eyestalks that crown its body twist and turn to keep its foes in sight. When a beholder sleeps, it closes its central eye but leaves its smaller eyes open and alert.<br/><br/><b>Xenophobic Isolationists</b>. Enemies abound, or so every beholder believes. Beholders are convinced that other creatures resent them for their brilliance and magical power, even as they dismiss those lesser creatures as crude and disgusting. Beholders always suspect others of plotting against them, even when no other creatures are around.<br/>The disdain a beholder has for other creatures extends to other beholders. Each beholder believes its form to be an ideal, and that any deviation from that form is a flaw in the racial purity of its kind. Beholders vary greatly in their physical forms, making conflict between them inevitable. Some beholders are protected by overlapping chitinous plates. Some have smooth hides. Some have eyestalks that writhe like tentacles, while others' stalks bear crustacean-like joints. Even slight differences of coloration in hide can turn two beholders into lifelong enemies.<br/><br/><b>Eye Tyrant</b>. Some beholders manage to channel their xenophobic tendencies into a terrible despotism. Rather than live in isolation, the aptly named eye tyrants enslave those other creatures, founding and controlling vast empires. An eye tyrant sometimes carves out a domain within or under a major city, commanding networks of agents that operate on their master's behalf.<br/><br/><b>Alien Lairs</b>. Because they refuse to share territory with others, most beholders withdraw to frigid hills, abandoned ruins, and deep caverns to scheme. A beholder's lair is carved out by its disintegration eye ray, emphasizing vertical passages connecting chambers stacked on top of each other. Such an environment allows a beholder to move freely, even as it prevents intruders from easily creeping about. When intruders do break in, the height of its open ceilings allows a beholder to float up and harry foes on the floor.<br/>As alien as their creator, the rooms in a beholder's lair reflect the creature's arrogance. It festoons its chambers with trophies from the battles it has won, including petrified adventurers standing frozen in their horrified final moments, pieces of other beholders, and magic items wrested from powerful foes. A beholder judges its own worth by its acquisitions, and it never willingly parts with its treasures.","monsters":["beholder","death-tyrant","gazer","spectator"],"page":26},{"index":"blight","name":"Blights","book":"Monster Manual","desc":"Awakened plants gifted with the powers of intelligence and mobility, blights plague lands contaminated by darkness. Drinking that darkness from the soil, a blight carries out the will of ancient evil and attempts to spread that evil wherever it can.<br/><br/><b>Roots of the Gulthias Tree</b>. Legends tell of a vampire named Gulthias who worked terrible magic and raised up an abominable tower called Nightfang Spire. Gulthias was undone when a hero plunged a wooden stake through his heart, but as the vampire was destroyed, his blood infused the stake with a dreadful power. In time, tendrils of new growth sprouted from the wood, growing into a sapling infused with the vampire's evil essence. It is said that a mad druid discovered the sapling, transplanting it to an underground grotto where it could grow. From this Gulthias tree came the seeds from which the first blights were sown.<br/><br/><b>Dark Conquest</b>. Wherever a tree or plant is contaminated by a fragment of an evil mind or power, a Gulthias tree can rise to infest and corrupt the surrounding forest. Its evil spreads through root and soil to other plants, which perish or transform into blights. As those blights spread, they poison and uproot healthy plants, replacing them with brambles, toxic weeds, and others of their kind. In time, an infestation of blights can turn any land or forest into a place of corruption.<br/>In forests infested with blights, trees and plants grow with supernatural speed. Vines and undergrowth rapidly spread through buildings and overrun trails and roads. After blights have killed or driven off their inhabitants, whole villages can disappear in the space of days.<br/><br/><b>Controlled by Evil</b>. Blights are independent creatures, but most act under a Gulthias tree's control, often displaying the habits and traits of the life force or spirit that spawned them. By attacking their progenitor's old foes or seeking out treasures valuable to it, they carry on the legacy of long-lost evil.","monsters":["needle-blight","twig-blight","vine-blight"],"page":31},{"index":"demon","name":"Demons","book":"Monster Manual","desc":"Spawned in the Infinite Layers of the Abyss, demons are the embodiment of chaos and evil-engines of destruction barely contained in monstrous form. Possessing no compassion, empathy, or mercy, they exist only to destroy.<br/><br/><b>Spawn of Chaos</b>. The Abyss creates demons as extensions of itself, spontaneously forming fiends out of filth and carnage. Some are unique monstrosities, while others represent uniform strains virtually identical to each other. Other demons (such as manes) are created from mortal souls shunned or cursed by the gods, or which are otherwise trapped in the Abyss.<br/><br/><b>Capricious Elevation</b>. Demons respect power and power alone. A greater demon commands shrieking mobs of lesser demons because it can destroy any lesser demon that dares to refuse its commands. A demon's status grows with the blood it spills; the more enemies that fall before it, the greater it becomes.<br/>A demon might spawn as a manes, then become a dretch, and eventually transform to a vrock after untold time spent fighting and surviving in the Abyss. Such elevations are rare, however, for most demons are destroyed before they attain significant power. The greatest of those that do survive make up the ranks of the demon lords that threaten to tear the Abyss apart with their endless warring.<br/>By expending considerable magical power, demon lords can raise lesser demons into greater forms, though such promotions never stem from a demon's deeds or accomplishme